{
  "$schema": "../schema/agentroom-v1.schema.json",
  "schema": "solo-suite/agentroom-v1",
  "name": "production-release",
  "version": 1,
  "prepared": false,
  "run_id": "template-production-release-v1",
  "description": "Collect and validate release evidence without deploying or publishing.",
  "based_on_room": "Solo Suite release and production-readiness rooms",
  "profile": "profile-selected-at-runtime",
  "memory_dir": ".solo/",
  "rules": [
    "Replace the template run_id with a unique run id before execution.",
    "Only memory_steward writes .solo files; every other seat submits declared proposals.",
    "Run seats in isolated worktrees and enforce every artifact lock.",
    "Require exact run, commit, and environment matches; reject expired gate evidence.",
    "Evaluate gate transitions from validated machine-readable status fields; unknown or missing statuses stop the run.",
    "Execute provider-specific checks only when .solo/stack.md records that provider.",
    "For profile-inapplicable work, record an evidence-backed N/A reason instead of silently skipping it."
  ],
  "memory_steward": {
    "seat_id": "memory_steward",
    "task_id_pattern": "^T[0-9]+$",
    "proposal_merge_policy": "Allocate task IDs centrally and merge conflict-free proposals after each stage while preserving append-only decisions.",
    "conflict_policy": "Stop the stage and require an explicit resolution before any conflicting shared-memory proposal is committed."
  },
  "tasks": [],
  "workspaces": [
    {
      "id": "shared_memory",
      "type": "shared-memory",
      "path": ".solo/",
      "owner": "memory_steward"
    },
    {
      "id": "evidence_collector_workspace",
      "type": "worktree",
      "path": "worktrees/production-release/evidence_collector",
      "owner": "evidence_collector"
    },
    {
      "id": "devops_engineer_workspace",
      "type": "worktree",
      "path": "worktrees/production-release/devops_engineer",
      "owner": "devops_engineer"
    },
    {
      "id": "documentation_writer_workspace",
      "type": "worktree",
      "path": "worktrees/production-release/documentation_writer",
      "owner": "documentation_writer"
    },
    {
      "id": "before_deploy_gatekeeper_workspace",
      "type": "worktree",
      "path": "worktrees/production-release/before_deploy_gatekeeper",
      "owner": "before_deploy_gatekeeper"
    },
    {
      "id": "production_gatekeeper_workspace",
      "type": "worktree",
      "path": "worktrees/production-release/production_gatekeeper",
      "owner": "production_gatekeeper"
    }
  ],
  "artifact_locks": [
    {
      "artifact": ".solo/architecture.md",
      "owner": "memory_steward"
    },
    {
      "artifact": ".solo/bugs.md",
      "owner": "memory_steward"
    },
    {
      "artifact": ".solo/decisions.md",
      "owner": "memory_steward"
    },
    {
      "artifact": ".solo/design.md",
      "owner": "memory_steward"
    },
    {
      "artifact": ".solo/handoff.md",
      "owner": "memory_steward"
    },
    {
      "artifact": ".solo/prd.md",
      "owner": "memory_steward"
    },
    {
      "artifact": ".solo/project.md",
      "owner": "memory_steward"
    },
    {
      "artifact": ".solo/release.md",
      "owner": "memory_steward"
    },
    {
      "artifact": ".solo/risks.md",
      "owner": "memory_steward"
    },
    {
      "artifact": ".solo/stack.md",
      "owner": "memory_steward"
    },
    {
      "artifact": ".solo/tasks.md",
      "owner": "memory_steward"
    },
    {
      "artifact": ".solo/tests.md",
      "owner": "memory_steward"
    },
    {
      "artifact": "artifacts/gates/production-release-before-deploy.json",
      "owner": "before_deploy_gatekeeper"
    },
    {
      "artifact": "artifacts/gates/production-release.json",
      "owner": "production_gatekeeper"
    },
    {
      "artifact": "artifacts/production-release/categories/analytics.json",
      "owner": "evidence_collector"
    },
    {
      "artifact": "artifacts/production-release/categories/architecture.json",
      "owner": "evidence_collector"
    },
    {
      "artifact": "artifacts/production-release/categories/backend.json",
      "owner": "evidence_collector"
    },
    {
      "artifact": "artifacts/production-release/categories/database.json",
      "owner": "evidence_collector"
    },
    {
      "artifact": "artifacts/production-release/categories/deployment.json",
      "owner": "evidence_collector"
    },
    {
      "artifact": "artifacts/production-release/categories/design.json",
      "owner": "evidence_collector"
    },
    {
      "artifact": "artifacts/production-release/categories/documentation.json",
      "owner": "evidence_collector"
    },
    {
      "artifact": "artifacts/production-release/categories/frontend.json",
      "owner": "evidence_collector"
    },
    {
      "artifact": "artifacts/production-release/categories/monitoring.json",
      "owner": "evidence_collector"
    },
    {
      "artifact": "artifacts/production-release/categories/performance.json",
      "owner": "evidence_collector"
    },
    {
      "artifact": "artifacts/production-release/categories/product.json",
      "owner": "evidence_collector"
    },
    {
      "artifact": "artifacts/production-release/categories/security.json",
      "owner": "evidence_collector"
    },
    {
      "artifact": "artifacts/production-release/categories/seo.json",
      "owner": "evidence_collector"
    },
    {
      "artifact": "artifacts/production-release/categories/testing.json",
      "owner": "evidence_collector"
    },
    {
      "artifact": "artifacts/production-release/project-profile.json",
      "owner": "evidence_collector"
    },
    {
      "artifact": "artifacts/production-release/release-docs.json",
      "owner": "documentation_writer"
    },
    {
      "artifact": "artifacts/production-release/release-plan.json",
      "owner": "devops_engineer"
    },
    {
      "artifact": "artifacts/production-release/rollback.json",
      "owner": "devops_engineer"
    }
  ],
  "stages": [
    {
      "id": "collect_evidence",
      "seats": [
        "memory_steward",
        "evidence_collector"
      ]
    },
    {
      "id": "release_planning",
      "seats": [
        "memory_steward",
        "devops_engineer"
      ]
    },
    {
      "id": "release_documentation",
      "seats": [
        "memory_steward",
        "documentation_writer"
      ]
    },
    {
      "id": "before_deploy",
      "seats": [
        "memory_steward",
        "before_deploy_gatekeeper"
      ]
    },
    {
      "id": "production_gate",
      "seats": [
        "memory_steward",
        "production_gatekeeper"
      ]
    }
  ],
  "seats": [
    {
      "id": "memory_steward",
      "kind": "memory-steward",
      "persistent": true,
      "role": "Memory Steward",
      "model_hint": "strong-reasoning",
      "workspace": "shared_memory",
      "memory_access": "direct",
      "reads": [
        ".solo/architecture.md",
        ".solo/bugs.md",
        ".solo/decisions.md",
        ".solo/design.md",
        ".solo/handoff.md",
        ".solo/prd.md",
        ".solo/project.md",
        ".solo/release.md",
        ".solo/risks.md",
        ".solo/stack.md",
        ".solo/tasks.md",
        ".solo/tests.md"
      ],
      "writes": [
        ".solo/architecture.md",
        ".solo/bugs.md",
        ".solo/decisions.md",
        ".solo/design.md",
        ".solo/handoff.md",
        ".solo/prd.md",
        ".solo/project.md",
        ".solo/release.md",
        ".solo/risks.md",
        ".solo/stack.md",
        ".solo/tasks.md",
        ".solo/tests.md"
      ],
      "proposals": [],
      "commands": [],
      "deliverable": "Allocate unique task IDs; merge proposals into tasks, decisions, and handoffs; reject conflicting shared-memory updates.",
      "handoff_to": null,
      "handoff_check": null,
      "task_ids": []
    },
    {
      "id": "evidence_collector",
      "kind": "worker",
      "persistent": false,
      "role": "Release Evidence Collector",
      "model_hint": "balanced",
      "workspace": "evidence_collector_workspace",
      "memory_access": "propose-only",
      "reads": [
        ".solo/project.md",
        ".solo/release.md",
        ".solo/stack.md",
        ".solo/tests.md"
      ],
      "writes": [
        "artifacts/production-release/categories/analytics.json",
        "artifacts/production-release/categories/architecture.json",
        "artifacts/production-release/categories/backend.json",
        "artifacts/production-release/categories/database.json",
        "artifacts/production-release/categories/deployment.json",
        "artifacts/production-release/categories/design.json",
        "artifacts/production-release/categories/documentation.json",
        "artifacts/production-release/categories/frontend.json",
        "artifacts/production-release/categories/monitoring.json",
        "artifacts/production-release/categories/performance.json",
        "artifacts/production-release/categories/product.json",
        "artifacts/production-release/categories/security.json",
        "artifacts/production-release/categories/seo.json",
        "artifacts/production-release/categories/testing.json",
        "artifacts/production-release/project-profile.json"
      ],
      "proposals": [
        ".solo/architecture.md",
        ".solo/bugs.md",
        ".solo/decisions.md",
        ".solo/design.md",
        ".solo/handoff.md",
        ".solo/prd.md",
        ".solo/release.md",
        ".solo/risks.md",
        ".solo/stack.md",
        ".solo/tasks.md",
        ".solo/tests.md"
      ],
      "commands": [
        "$stack-intake",
        "$spec-acceptance",
        "$project-architecture",
        "$design-ui-review",
        "$browser-smoke-test",
        "$api-audit",
        "$database-audit",
        "$security-review",
        "$test-unit",
        "$site-doctor-perf",
        "$site-doctor-seo",